[
  { "term": "Муассель", "category": "табак", "definition": "Самый распространённый кальянный табак: лист, пропитанный сиропом, глицерином и ароматизаторами.", "articleRef": "02-tabak/osnova-i-sostav" },
  { "term": "Бестабачка", "category": "табак", "definition": "Смесь без табачного листа (чайная основа, камни, кремы). Бывает никотиновой и безникотиновой.", "articleRef": "00-osnovy/bestabachnye-smesi" },
  { "term": "Журак", "category": "табак", "definition": "Чёрный непромытый табак, очень крепкий и насыщенный.", "articleRef": "02-tabak/tipy-lista-i-narezka" },
  { "term": "Отжимка", "category": "табак", "definition": "Удаление лишнего сиропа из влажного табака перед забивкой.", "articleRef": "02-tabak/osnova-i-sostav" },
  { "term": "Шахта", "category": "оборудование", "definition": "Центральная трубка кальяна.", "articleRef": "00-osnovy/ustroystvo-kalyana" },
  { "term": "Колба", "category": "оборудование", "definition": "Сосуд с жидкостью.", "articleRef": "00-osnovy/ustroystvo-kalyana" },
  { "term": "Чаша (чилим)", "category": "оборудование", "definition": "Ёмкость для табака.", "articleRef": "05-chashi/vidy-chash" },
  { "term": "Калауд", "category": "оборудование", "definition": "Металлическое устройство, заменяющее фольгу: держит угли и изолирует их от табака.", "articleRef": "06-nagrev/upravlenie-zharom" },
  { "term": "Колпак", "category": "оборудование", "definition": "Ветрозащита: накрывает чашу/калауд для прогрева и защиты от искр.", "articleRef": "01-oborudovanie/aksessuary" },
  { "term": "HMD", "category": "оборудование", "definition": "Heat management device — устройство управления жаром (калауд и аналоги).", "articleRef": "06-nagrev/upravlenie-zharom" },
  { "term": "Диффузор", "category": "оборудование", "definition": "Перфорированная насадка на конце шахты: дробит дым на мелкие пузыри, снижает бульканье и улучшает охлаждение.", "articleRef": "01-oborudovanie/kak-vybrat-kalyan" },
  { "term": "Уплотнитель", "category": "оборудование", "definition": "Силиконовое/резиновое кольцо для герметизации стыков.", "articleRef": "01-oborudovanie/kak-vybrat-kalyan" },
  { "term": "Продувочный клапан", "category": "оборудование", "definition": "Шариковый клапан для выдувания дыма из колбы.", "articleRef": "00-osnovy/ustroystvo-kalyana" },
  { "term": "Щипцы", "category": "оборудование", "definition": "Инструмент для переноса раскалённых углей и ротации.", "articleRef": "01-oborudovanie/aksessuary" },
  { "term": "Плитка", "category": "оборудование", "definition": "Устройство для розжига углей.", "articleRef": "03-ugli/vidy-uglej-i-rozzhig" },
  { "term": "Клинер", "category": "оборудование", "definition": "Чистящее средство для шахты/шланга/колбы.", "articleRef": "09-uhod/chistka-i-hranenie" },
  { "term": "Фанел", "category": "чаши", "definition": "Чаша с центральным бортиком и одним большим отверстием; держит сироп.", "articleRef": "05-chashi/vidy-chash" },
  { "term": "Турка", "category": "чаши", "definition": "Классическая чаша с несколькими отверстиями на дне.", "articleRef": "05-chashi/vidy-chash" },
  { "term": "Убивашка", "category": "чаши", "definition": "Чаша с плоским дном под крепкие табаки и оверпак.", "articleRef": "05-chashi/vidy-chash" },
  { "term": "Воздушная забивка", "category": "забивка", "definition": "Рыхлая укладка без трамбовки.", "articleRef": "04-zabivka/bazovye-metody" },
  { "term": "Плотная забивка", "category": "забивка", "definition": "Уплотнённая укладка под крепкие табаки.", "articleRef": "04-zabivka/bazovye-metody" },
  { "term": "Оверпак", "category": "забивка", "definition": "Забивка горкой выше краёв с образованием защитной корочки.", "articleRef": "04-zabivka/prodvinutye-tehniki" },
  { "term": "Касание (халфпак)", "category": "забивка", "definition": "Табак вплотную к фольге/калауду — продвинутая техника для крепости.", "articleRef": "04-zabivka/prodvinutye-tehniki" },
  { "term": "Отступ", "category": "забивка", "definition": "Зазор между табаком и фольгой/калаудом (обычно 3–5 мм).", "articleRef": "04-zabivka/bazovye-metody" },
  { "term": "Раскур", "category": "процесс", "definition": "Прогрев чаши до появления дыма.", "articleRef": "08-masterstvo/prigotovlenie-i-nastrojka" },
  { "term": "Прокрутка", "category": "процесс", "definition": "Перемешивание/переворачивание табака для равномерного прогрева.", "articleRef": "08-masterstvo/prigotovlenie-i-nastrojka" },
  { "term": "Ротация углей", "category": "процесс", "definition": "Перестановка углей для управления жаром.", "articleRef": "06-nagrev/upravlenie-zharom" },
  { "term": "Продувка", "category": "процесс", "definition": "Выдувание застоявшегося дыма через клапан.", "articleRef": "00-osnovy/ustroystvo-kalyana" },
  { "term": "Жар", "category": "процесс", "definition": "Температурный режим чаши; ключ к вкусу и отсутствию горечи.", "articleRef": "06-nagrev/upravlenie-zharom" },
  { "term": "Микс", "category": "процесс", "definition": "Смесь нескольких вкусов табака.", "articleRef": "07-miksologiya/principy-miksologii" },
  { "term": "Моно (моновкус)", "category": "процесс", "definition": "Один вкус табака без смешивания.", "articleRef": "07-miksologiya/principy-miksologii" },
  { "term": "Кокосовый уголь", "category": "угли", "definition": "Прессованный из кокосовой скорлупы; долго горит, ровный жар.", "articleRef": "03-ugli/vidy-uglej-i-rozzhig" },
  { "term": "Саморозжиг", "category": "угли", "definition": "Уголь с селитрой, зажигается от зажигалки; даёт привкус, для дома нежелателен.", "articleRef": "03-ugli/vidy-uglej-i-rozzhig" },
  { "term": "Кубик / каб", "category": "угли", "definition": "Единица угля (обычно 22×22 или 25×25 мм).", "articleRef": "03-ugli/vidy-uglej-i-rozzhig" }
]
